{
  "schemaVersion": "digital-twin.lineage.v1",
  "lineageId": "LIN-KAL-01-CORE-DISTRIBUTION",
  "valueId": "VAL-KAL-01-IMPUTED-CORE-DISTRIBUTION",
  "valueBasis": "imputed",
  "inputs": [
    {
      "sourceKind": "scada-tag",
      "sourceId": "TAG-KAL-01-FLUX-LOW",
      "valueBasis": "measured"
    },
    {
      "sourceKind": "scada-tag",
      "sourceId": "TAG-KAL-01-FLUX-MID",
      "valueBasis": "measured"
    },
    {
      "sourceKind": "scada-tag",
      "sourceId": "TAG-KAL-01-FLUX-HIGH",
      "valueBasis": "measured"
    },
    {
      "sourceKind": "digital-twin-model",
      "sourceId": "MODEL-KALEIDOS-PRISMATIC-V0",
      "valueBasis": "imputed"
    },
    {
      "sourceKind": "simulation-run",
      "sourceId": "RUN-KAL-01-SCHED-DRIFT",
      "valueBasis": "simulated"
    }
  ],
  "processingSteps": [
    "Require multiple flux stand-ins before showing a coarse distribution estimate",
    "Project a public-safe axial and radial overlay",
    "Label the value as an estimate rather than validated neutronics"
  ],
  "artifacts": [
    {
      "artifactId": "SIMWB-VISUAL-DRAFT-001",
      "path": "docs/design/simulator-workbench-visual-draft.md",
      "mediaType": "text/markdown"
    }
  ]
}
