{
  "schemaVersion": "digital-twin.lineage.v1",
  "lineageId": "LIN-KAL-04-COOLDOWN-HEAT",
  "valueId": "VAL-KAL-04-IMPUTED-COOLDOWN-HEAT",
  "valueBasis": "imputed",
  "inputs": [
    {
      "sourceKind": "scada-tag",
      "sourceId": "TAG-KAL-04-BOUNDARY-TEMP",
      "valueBasis": "measured"
    },
    {
      "sourceKind": "scada-tag",
      "sourceId": "TAG-KAL-04-RESIDUAL-HEAT",
      "valueBasis": "measured"
    },
    {
      "sourceKind": "digital-twin-model",
      "sourceId": "MODEL-KALEIDOS-COOLDOWN-V0",
      "valueBasis": "imputed"
    },
    {
      "sourceKind": "simulation-run",
      "sourceId": "RUN-KAL-04-COOLDOWN-CONTEXT",
      "valueBasis": "simulated"
    }
  ],
  "processingSteps": [
    "Treat residual heat as reactor-state context",
    "Do not convert cooldown heat into delivered commercial output",
    "Keep the display basis public-safe and read-only"
  ],
  "artifacts": [
    {
      "artifactId": "SIMWB-VISUAL-DRAFT-001",
      "path": "docs/design/simulator-workbench-visual-draft.md",
      "mediaType": "text/markdown"
    }
  ]
}
